Genre,Title,price,Stock,Star,UPC,Type,Tax,Number of reviews,desc
Default,The Emerald Mystery,23.15,15,2,d6670dfe3e7b42bd,Books,0,0,Three young adults are invited to spend a weekend at the exotic Timber Island. Maria is a professional in the sport of bodyboarding. Tina is an apprentice of the sport but very athletic  and she possesses other skills. And lastly there is Axell  a traveler and a veteran bodyboarder. For them||Fore More You should read this books. Thanks
Default,The Bridge to Consciousness: I'm Writing the Bridge Between Science and Our Old and New Beliefs.,32,15,3,efc3768127714ec3,Books,0,0,"





||Fore More You should read this books. Thanks"
Default,The Art of War,33.34,15,5,e7469e22b5bfb3e7,Books,0,0,Conflict is an inevitable part of life  according to this ancient Chinese classic of strategy  but everything necessary to deal with conflict wisely||Fore More You should read this books. Thanks
Default,Secrets and Lace (Fatal Hearts #1),20.27,15,1,ad04ad9fc179fc5d,Books,0,0,**WARNING: Due to sexual situations and adult content  this dark romance thriller series is not intended for readers under the age of 18  and anyone who is unable to read books containing||Fore More You should read this books. Thanks
Default,Romero and Juliet: A Tragic Tale of Love and Zombies,36.94,15,1,e656e280bc8edd56,Books,0,0,You all know the tale. Star-crossed lovers meet; all they want is what they cannot have. Each other. It's a story as old as time - or is it? The headstrong Romero of the house of Montague holds nothing but contempt for the cowardly DeCapulets. Until  that is  he meets Juliet. Beautiful; deadly; her skill with a bow is matched by no other||Fore More You should read this books. Thanks
Default,Poses for Artists Volume 1 - Dynamic and Sitting Poses: An Essential Reference for Figure Drawing and the Human Form,41.06,15,1,d9c643fa1fc57bdb,Books,0,0,This book was created by an artist who understands that sometimes  you just need a creative nudge to help get the pencil moving and break that pesky block. By simplifying the human form  we hope to remove the inevitable anxiety that comes with drawing a person||Fore More You should read this books. Thanks
Default,Miss Peregrine’s Home for Peculiar Children (Miss Peregrine’s Peculiar Children #1),10.76,15,1,af96613fdd793a3c,Books,0,0,A mysterious island. An abandoned orphanage. A strange collection of curious photographs.A horrific family tragedy sets sixteen-year-old Jacob journeying to a remote island off the coast of Wales  where he discovers the crumbling ruins of Miss Peregrine’s Home for Peculiar Children. As Jacob explores its abandoned bedrooms and hallways  it becomes clear that the children w A mysterious island. An abandoned orphanage. A strange collection of curious photographs.A horrific family tragedy sets sixteen-year-old Jacob journeying to a remote island off the coast of Wales||Fore More You should read this books. Thanks
Default,Large Print Heart of the Pride,19.15,15,2,c1afd71fc86bf682,Books,0,0,Paranormal Romance Erotic Werelion Thrill Ride. Book 1 of the Fur  Lust & Magic series.Alexis is finally getting to go to school  to study music. Since her Mom died in a suspicious car crash||Fore More You should read this books. Thanks
Default,Grumbles,22.16,15,2,d163dd6c352fbcd2,Books,0,0,Grumbles is a little Nid that goes on her first day to school and has to answer the question of what she wants to be when she grows up. First Time Reader BookWritten and Illustrated by Sondra Faye||Fore More You should read this books. Thanks
Default,First Steps for New Christians (Print Edition),29,15,1,2f88b08bf0a0e367,Books,0,0,Our enemy  the devil  prowls around like a lion. (1 Peter 5:8) All he wants to do is steal||Fore More You should read this books. Thanks
Default,Eureka Trivia 6.0,54.59,15,4,29c0025455f8c585,Books,0,0,Eureka Trivia 6.0 is a great trivia book for all Eureka fans. With over 300 questions  this trivia book is designed so you can play single games  group games||Fore More You should read this books. Thanks
Default,Drive: The Surprising Truth About What Motivates Us,34.95,15,4,6ffb36aaeff1c81e,Books,0,0,Forget everything you thought you knew about how to motivate people—at work  at school  at home. It's wrong. As Daniel H. Pink (author of To Sell Is Human: The Surprising Truth About Motivating Others) explains in his paradigm-shattering book Drive||Fore More You should read this books. Thanks
Default,Done Rubbed Out (Reightman & Bailey #1),37.72,15,5,f6d967cdadc6fbd9,Books,0,0,In this first book of the Reightman & Bailey Series  deceit  corruption and murder tangle together with vivid||Fore More You should read this books. Thanks
Default,Beauty Restored (Riley Family Legacy Novellas #3),11.11,15,2,3f69e667a67e54d9,Books,0,0,While volunteering at a youth camp in the Ozark Mountains  Carmen Riley sponsors a challenging group of teenage girls. She longs to make a difference in their lives  but unsettling news from home rattles her confidence. When Carmen meets a charming young pastor||Fore More You should read this books. Thanks
Default,Ayumi's Violin,15.48,15,2,05f7c6d9a4e582d3,Books,0,0,In 1959 when her mother dies  twelve-year-old Ayumi leaves her home in Japan to find her American father. Biracial  she is confronted with a resentful half-sister and a racist stepmother. She wants to be accepted by her new family||Fore More You should read this books. Thanks
Default,Anonymous,46.82,15,4,d24b829be2ca81c4,Books,0,0,Logan Matthews is a father  architect  and widower. He lives in Brooklyn||Fore More You should read this books. Thanks
Default,Amy Meets the Saints and Sages,18.46,15,3,7ebfa6c1bee69e1e,Books,0,0,"All major religions have saints and sages that are pinnacles of love and integrity. Wouldn't your child benefit from having them as role models? Wouldn't it empower your child to know that these saints/sages are real people  some of whom are living right now?In ""Amy Meets the Saints and Sages  A Young Person's Adventures in Spirituality"" your child gets to meet six saints/ All major religions have saints and sages that are pinnacles of love and integrity. Wouldn't your child benefit from having them as role models? Wouldn't it empower your child to know that these saints/sages are real people||Fore More You should read this books. Thanks"
Default,Amatus,50.54,15,5,ffd54178acc9a6a5,Books,0,0,Crispian  who has lived in a city of darkness all his life  must make a choice: remain safe in his home||Fore More You should read this books. Thanks
Default,V for Vendetta (V for Vendetta Complete),37.1,14,4,4a1debca3135ff37,Books,0,0,"""Remember  remember the fifth of November...""A frightening and powerful tale of the loss of freedom and identity in a chillingly believable totalitarian world  V for Vendetta stands as one of the highest achievements of the comics medium and a defining work for creators Alan Moore and David Lloyd.Set in an imagined future England that has given itself over to fascism||Fore More You should read this books. Thanks"
Default,"Unbroken: A World War II Story of Survival, Resilience, and Redemption",45.95,14,2,76c84daa539426e2,Books,0,0,On a May afternoon in 1943  an Army Air Forces bomber crashed into the Pacific Ocean and disappeared  leaving only a spray of debris and a slick of oil||Fore More You should read this books. Thanks
Default,The Wright Brothers,56.8,14,4,08b2f71d93836313,Books,0,0,Two-time winner of the Pulitzer Prize David McCullough tells the dramatic story-behind-the-story about the courageous brothers who taught the world how to fly: Wilbur and Orville Wright.On a winter day in 1903  in the Outer Banks of North Carolina  two unknown brothers from Ohio changed history. But it would take the world some time to believe what had happened: the age of Two-time winner of the Pulitzer Prize David McCullough tells the dramatic story-behind-the-story about the courageous brothers who taught the world how to fly: Wilbur and Orville Wright.On a winter day in 1903||Fore More You should read this books. Thanks
Default,The Songs of the Gods,44.48,14,5,00c4543ec6bd25b4,Books,0,0,"The Power of Dream ""It has been ages since the last time you enjoyed the night more than what you enjoy your overcoat. Then you would dance the night  now you wear the night  It is an accessory to hide you from everyone."" The Songs of the Gods is a collection of poems reaching deep into the human soul. Love||Fore More You should read this books. Thanks"
Default,The Rosie Project (Don Tillman #1),54.04,14,1,012094e90a4b908d,Books,0,0,An international sensation  this hilarious  feel-good novel is narrated by an oddly charming and socially challenged genetics professor on an unusual quest: to find out if he is capable of true love.Don Tillman||Fore More You should read this books. Thanks
Default,The Power of Habit: Why We Do What We Do in Life and Business,16.88,14,3,6bdd909329435e80,Books,0,0,A young woman walks into a laboratory. Over the past two years  she has transformed almost every aspect of her life. She has quit smoking  run a marathon||Fore More You should read this books. Thanks
Default,Steve Jobs,39.5,14,5,95019eac1c0a052f,Books,0,0,From best-selling author Walter Isaacson comes the landmark biography of Apple co-founder Steve Jobs.In Steve Jobs: The Exclusive Biography  Isaacson provides an extraordinary account of Jobs' professional and personal life. Drawn from three years of exclusive and unprecedented interviews Isaacson has conducted with Jobs as well as extensive interviews with Jobs' family me From best-selling author Walter Isaacson comes the landmark biography of Apple co-founder Steve Jobs.In Steve Jobs: The Exclusive Biography  Isaacson provides an extraordinary account of Jobs' professional and personal life. Drawn from three years of exclusive and unprecedented interviews Isaacson has conducted with Jobs as well as extensive interviews with Jobs' family members and key colleagues from Apple and its competitors||Fore More You should read this books. Thanks
Default,Luckiest Girl Alive,49.83,14,3,d512871626a5e588,Books,0,0,HER PERFECT LIFE IS A PERFECT LIE.As a teenager at the prestigious Bradley School  Ani FaNelli endured a shocking  public humiliation that left her desperate to reinvent herself. Now||Fore More You should read this books. Thanks
Default,"Living Leadership by Insight: A Good Leader Achieves, a Great Leader Builds Monuments",46.91,14,4,17fb5a88180f9904,Books,0,0,Learning not shared is learning wasted. In my thirty-five years of experience in the oil and banking industries  including ascending levels of management and leadership responsibilities  I have gained what I believe to be valuable insight into many styles of leadership. Former President of the United States||Fore More You should read this books. Thanks
Default,Lady Midnight (The Dark Artifices #1),16.28,14,5,708345c9897fd7c5,Books,0,0,In a kingdom by the sea…In a secret world where half-angel warriors are sworn to fight demons  parabatai is a sacred word.A parabatai is your partner in battle. A parabatai is your best friend. Parabatai can be everything to each other—but they can never fall in love.Emma Carstairs is a warrior  a Shadowhunter||Fore More You should read this books. Thanks
Default,"Hush, Hush (Hush, Hush #1)",47.02,14,3,6b6cd77fbc91b7a6,Books,0,0,A SACRED OATHA FALLEN ANGELA FORBIDDEN LOVERomance was not part of Nora Grey's plan. She's never been particularly attracted to the boys at her school  no matter how hard her best friend  Vee||Fore More You should read this books. Thanks
Default,Greek Mythic History,10.23,14,5,f201f263d8c23f97,Books,0,0,"As far back as the fifth century BCE Pherecydes and others attempted to integrate city-state stories into a coherent mythic Greek pre-history. Science unavailable to ancient sources helped guide author Spencer Clevenger to critical insights and intriguing results. In ""Greek Mythic History "" he weaves myths concerning gods  kings||Fore More You should read this books. Thanks"
Default,Every Last Word,46.47,14,3,a2bd4ca82d908442,Books,0,0,If you could read my mind  you wouldn't be smiling.Samantha McAllister looks just like the rest of the popular girls in her junior class. But hidden beneath the straightened hair and expertly applied makeup is a secret that her friends would never understand: Sam has Purely-Obsessional OCD and is consumed by a stream of dark thoughts and worries that she can't turn off. Se If you could read my mind  you wouldn't be smiling.Samantha McAllister looks just like the rest of the popular girls in her junior class. But hidden beneath the straightened hair and expertly applied makeup is a secret that her friends would never understand: Sam has Purely-Obsessional OCD and is consumed by a stream of dark thoughts and worries that she can't turn off. Second-guessing every move||Fore More You should read this books. Thanks
Default,Daily Fantasy Sports,36.58,14,1,0e94a089328be4bc,Books,0,0,The businesses of the Fantasy Sports Trade Association have helped propel one of America’s most beloved pastimes into a 26 billion dollar industry. The advent of daily fantasy sports has created thousands of jobs  raised millions in tax dollars  and has given consumers endless ways to play fantasy sports. Unfortunately||Fore More You should read this books. Thanks
Default,Clockwork Angel (The Infernal Devices #1),44.14,14,1,42b0c50fc44140ec,Books,0,0,In a time when Shadowhunters are barely winning the fight against the forces of darkness  one battle will change the course of history forever. Welcome to the Infernal Devices trilogy  a stunning and dangerous prequel to the New York Times bestselling Mortal Instruments series.The year is 1878. Tessa Gray descends into London’s dark supernatural underworld in search of her In a time when Shadowhunters are barely winning the fight against the forces of darkness||Fore More You should read this books. Thanks
Default,City of Fallen Angels (The Mortal Instruments #4),11.23,14,4,1e264c677d4ee4ae,Books,0,0,The Mortal War is over  and sixteen-year-old Clary Fray is back home in New York  excited about all the possibilities before her. She’s training to become a Shadowhunter and to use her unique power. Her mother is getting married to the love of her life. Downworlders and Shadowhunters are at peace at last. And—most importantly of all—she can finally call Jace her boyfriend. The Mortal War is over||Fore More You should read this books. Thanks
Default,City of Bones (The Mortal Instruments #1),43.28,14,1,5b987e54ee72525c,Books,0,0,When fifteen-year-old Clary Fray heads out to the Pandemonium Club in New York City  she hardly expects to witness a murder― much less a murder committed by three teenagers covered with strange tattoos and brandishing bizarre weapons. Then the body disappears into thin air. It's hard to call the police when the murderers are invisible to everyone else and when there is not When fifteen-year-old Clary Fray heads out to the Pandemonium Club in New York City  she hardly expects to witness a murder― much less a murder committed by three teenagers covered with strange tattoos and brandishing bizarre weapons. Then the body disappears into thin air. It's hard to call the police when the murderers are invisible to everyone else and when there is nothing―not even a smear of blood―to show that a boy has died. Or was he a boy?This is Clary's first meeting with the Shadowhunters||Fore More You should read this books. Thanks
Default,City of Ashes (The Mortal Instruments #2),47.27,14,1,8a6ec2761f91dad2,Books,0,0,Also see: Alternate Cover Editions for this ISBN [ACE] ACE #1 Clary Fray just wishes that her life would go back to normal. But what's normal when you're a demon-slaying Shadowhunter  your mother is in a magically induced coma  and you can suddenly see Downworlders like werewolves||Fore More You should read this books. Thanks
Default,"Carry On, Warrior: Thoughts on Life Unarmed",31.85,14,3,1b0fc9f777cad045,Books,0,0,An inspirational  sidesplittingly funny exploration of the power of living with love  forgiveness||Fore More You should read this books. Thanks
Default,Carrie,46.23,14,2,5f22418922fa728b,Books,0,0,Carrie knew she should not use the terrifying power she possessed... But one night at her senior prom  Carrie was scorned and humiliated just one time too many  and in a fit of uncontrollable fury she turned her clandestine game into a weapon of horror and destruction...||Fore More You should read this books. Thanks
Default,Angels & Demons (Robert Langdon #1),51.48,14,3,ad41c24ccac0c7ce,Books,0,0,When world-renowned Harvard symbologist Robert Langdon is summoned to a Swiss research facility to analyze a mysterious symbol—seared into the chest of a murdered physicist—he discovers evidence of the unimaginable: the resurgence of an ancient secret brotherhood known as the Illuminati ... the most powerful underground organization ever to walk the earth. The Illuminati h When world-renowned Harvard symbologist Robert Langdon is summoned to a Swiss research facility to analyze a mysterious symbol—seared into the chest of a murdered physicist—he discovers evidence of the unimaginable: the resurgence of an ancient secret brotherhood known as the Illuminati ... the most powerful underground organization ever to walk the earth. The Illuminati has now surfaced to carry out the final phase of its legendary vendetta against its most hated enemy—the Catholic Church. Langdon’s worst fears are confirmed on the eve of the holy conclave  when a messenger of the Illuminati announces they have hidden an unstoppable time bomb at the very heart of Vatican City. With the countdown under way  Langdon jets to Rome to join forces with Vittoria Vetra||Fore More You should read this books. Thanks
Default,"The Three Searches, Meaning, and the Story",13.33,13,3,ac5e0d3938caf686,Books,0,0,Human societies have always been preoccupied with three main searches: the Search for Technology  the Search for Truth  and the Search for Meaning. Social structures; currents of action and thought; philosophies; and history||Fore More You should read this books. Thanks
Default,Raspberry Pi Electronics Projects for the Evil Genius,49.67,12,4,ebf81a62e4798fd1,Books,0,0,"10 brand new DIY projects for your Raspberry Pi!This fully illustrated TAB guide shows how to construct and program all kinds of fun and innovative gadgets with your Raspberry Pi. ""Raspberry Pi Electronics Projects for the Evil Genius"" features 10 complete projects that showcase cool RasPi applications in computing  communications  robotics||Fore More You should read this books. Thanks"
Default,How to Speak Golf: An Illustrated Guide to Links Lingo,58.32,12,5,b978c9852cde91bd,Books,0,0,From ace to zinger  How to Speak Golf includes over 125 golf terms paired with charming and clever illustrations that decode the words and phrases that fly around a golf course. Clubhouse Chatter sections are sprinkled throughout where you'll learn about everything from the origins of golf  the worst courses and biggest sand bunkers in the world||Fore More You should read this books. Thanks
Default,Eleanor & Park,56.51,12,5,6983328f15506cb9,Books,0,0,Two misfits.One extraordinary love.Eleanor... Red hair  wrong clothes. Standing behind him until he turns his head. Lying beside him until he wakes up. Making everyone else seem drabber and flatter and never good enough...Eleanor.Park... He knows she'll love a song before he plays it for her. He laughs at her jokes before she ever gets to the punch line. There's a place on Two misfits.One extraordinary love.Eleanor... Red hair  wrong clothes. Standing behind him until he turns his head. Lying beside him until he wakes up. Making everyone else seem drabber and flatter and never good enough...Eleanor.Park... He knows she'll love a song before he plays it for her. He laughs at her jokes before she ever gets to the punch line. There's a place on his chest||Fore More You should read this books. Thanks
Default,Troublemaker: Surviving Hollywood and Scientology,48.39,11,2,515cb8fcafb1ad98,Books,0,0,The outspoken actress  talk show host  and reality television star offers up a no-holds-barred memoir||Fore More You should read this books. Thanks
Default,Adultery,20.88,11,5,bb967277222e689c,Books,0,0,I want to change. I need to change. I'm gradually losing touch with myself. Adultery  the provocative new novel by Paulo Coelho  best-selling author of The Alchemist and Eleven Minutes||Fore More You should read this books. Thanks
Default,Unlimited Intuition Now,58.87,9,4,4fd0a2a350f016e6,Books,0,0,Read Unlimited Intuition Now to develop your own psychic abilities so that you can receive guidance from your soul.How you will benefit:Pray to open your soul guidanceLearn how to read the energy in your chakras with a pendulumTune in to read your own bodyDiscover how to read the body of another personDiscern how much life force is in your foodFocus to tell if food is real Read Unlimited Intuition Now to develop your own psychic abilities so that you can receive guidance from your soul.How you will benefit:Pray to open your soul guidanceLearn how to read the energy in your chakras with a pendulumTune in to read your own bodyDiscover how to read the body of another personDiscern how much life force is in your foodFocus to tell if food is really good for your bodyPractice how to muscle test yourselfRaise your vibration to listen to your angelsGet your ego out of the way so you can listen to divine guidanceStay connected with loved ones when you are apartOpen your psychic centers of clairaudience  claircognizance  clairsentience and clairvoyanceAvoid other people’s ego projections to see what’s really going onProtect your energy so you feel safe and grounded at all times and in all placesStay out of trouble in dangerous situationsUnderstand how your different psychic gifts actually workDeepen your connection to God and feel supported on all levels ...more||Fore More You should read this books. Thanks
Default,Underlying Notes,11.82,9,2,0967effecd292a86,Books,0,0,"Carla Matteo copes with life by ""tipping the bottle""--glass goddesses funneling perfume! During a midlife renaissance  the ""juice"" enables Carla to find her own niche  while the ominous rose note in Paloma Picasso forces her to confront the past.||Fore More You should read this books. Thanks"
Default,The New Brand You: Your New Image Makes the Sale for You,44.05,9,5,4b50fb1359ebf35d,Books,0,0,You want people to recognize you  like you  and trust you||Fore More You should read this books. Thanks
Default,The Flowers Lied,16.68,9,2,33396269bcce166f,Books,0,0,Remember back when you first wanted to become a rock critic? Or when you first started to read music reviews? Those are the days of The Flowers Lied  Michael Goldberg's new rock ‘n’ roll coming-of-age novel. Writerman  the narrator||Fore More You should read this books. Thanks
Default,"NaNo What Now? Finding your editing process, revising your NaNoWriMo book and building a writing career through publishing and beyond",10.41,9,4,ee6c67859d70186b,Books,0,0,You’ve just completed a novel during the National Novel Writing Month challenge! Or maybe you completed part of one. Or signed up with really good intentions and then only wrote a couple of words. Either way  you’re staring at 30 days worth of words and wondering… What now? How exactly do you start a revision and discover your editing process? How do you know if you’re rea You’ve just completed a novel during the National Novel Writing Month challenge! Or maybe you completed part of one. Or signed up with really good intentions and then only wrote a couple of words. Either way  you’re staring at 30 days worth of words and wondering… What now? How exactly do you start a revision and discover your editing process? How do you know if you’re ready to hire an editor? How do you motivate yourself when faced with draft dread or editing blocks? How can you translate what you’ve accomplished so far into a professional writing career? From tips for finding beta readers||Fore More You should read this books. Thanks
Default,Modern Day Fables,47.44,9,2,6baac632f7711e26,Books,0,0,It is difficult to accurately summarize eleven very different stories  each of which stands alone. However  if there is a recurring theme in Modern Day Fables it is that of the eternal conflict between the individual and society||Fore More You should read this books. Thanks
Default,The Unlikely Pilgrimage of Harold Fry (Harold Fry #1),43.62,8,5,e0bdd79c7304ee8d,Books,0,0,Harold Fry is convinced that he must deliver a letter to an old friend in order to save her  meeting various characters along the way and reminiscing about the events of his past and people he has known  as he tries to find peace and acceptance.Recently retired||Fore More You should read this books. Thanks
Default,The Martian (The Martian #1),41.39,8,2,9afd00e81d6208e6,Books,0,0,A mission to Mars.A freak accident.One man's struggle to survive.Six days ago  astronaut Mark Watney became one of the first people to walk on Mars. Now  he's sure he'll be the first person to die there.After a dust storm nearly kills him and forces his crew to evacuate the planet while thinking him dead||Fore More You should read this books. Thanks
Default,Left Behind (Left Behind #1),40.72,8,2,29af1a2566c4e36e,Books,0,0,An airborne Boeing 747 is headed to London when  without any warning  passengers mysteriously disappear from their seats. Terror and chaos slowly spread not only through the plane but also worldwide as unusual events continue to unfold. For those who have been left behind||Fore More You should read this books. Thanks
