Genre,Title,price,Stock,Star,UPC,Type,Tax,Number of reviews,desc
Young Adult,Frostbite (Vampire Academy #2),29.99,15,5,116a2fdc9a45bab0,Books,0,0,WHEN LOVE AND JEALOUSY COLLIDE ON THE SLOPES  WINTER BREAK TURNS DEADLY...Lissa Dragomir is a Moroi princess: a mortal vampire with a rare gift for harnessing the earth's magic. She must be protected at all times from Strigoi; the fiercest vampires - the ones who never die. The powerful blend of human and vampire blood that flows through Rose Hathaway  Lissa's best friend||Fore More You should read this books. Thanks
Young Adult,Wild Swans,14.36,14,2,3fb15ace50d6142b,Books,0,0,The summer before Ivy’s senior year is going to be golden; all bonfires  barbeques  and spending time with her best friends. For once||Fore More You should read this books. Thanks
Young Adult,Until Friday Night (The Field Party #1),46.31,14,2,aba2db9afb1469c7,Books,0,0,To everyone who knows him  West Ashby has always been that guy: the cocky  popular||Fore More You should read this books. Thanks
Young Adult,This Is Where It Ends,27.12,14,2,f0f38174a7e689a3,Books,0,0,10:00 a.m. The principal of Opportunity High School finishes her speech  welcoming the entire student body to a new semester and encouraging them to excel and achieve.10:02 a.m. The students get up to leave the auditorium for their next class.10:03 a.m. The auditorium doors won't open.10:05 a.m. Someone starts shooting.Told from four different perspectives over the span of 10:00 a.m. The principal of Opportunity High School finishes her speech  welcoming the entire student body to a new semester and encouraging them to excel and achieve.10:02 a.m. The students get up to leave the auditorium for their next class.10:03 a.m. The auditorium doors won't open.10:05 a.m. Someone starts shooting.Told from four different perspectives over the span of fifty-four harrowing minutes||Fore More You should read this books. Thanks
Young Adult,The Darkest Lie,35.35,14,5,6edacfd1f8ebb9eb,Books,0,0,“The mother I knew would never do those things.But maybe I never knew her after all.”Clothes  jokes  coded messages…Cecilia Brooks and her mom shared everything. At least||Fore More You should read this books. Thanks
Young Adult,My Kind of Crazy,40.36,14,1,137b0b2775701e11,Books,0,0,Despite the best of intentions  seventeen-year old  wisecracking Hank Kirby can’t quite seem to catch a break. It’s not that he means to screw things up all the time||Fore More You should read this books. Thanks
Young Adult,Don't Get Caught,55.35,14,1,ad2887ce04583910,Books,0,0,10:00 tonight at the water tower. Tell no one. -Chaos ClubWhen Max receives a mysterious invite from the untraceable  epic prank-pulling Chaos Club  he has to ask: why him? After all||Fore More You should read this books. Thanks
Young Adult,Catching Jordan (Hundred Oaks),50.83,14,3,e2e7b683b4c15b7d,Books,0,0,ONE OF THE BOYSWhat girl doesn't want to be surrounded by gorgeous jocks day in and day out? Jordan Woods isn't just surrounded by hot guys  though-she leads them as the captain and quarterback of her high school football team. They all see her as one of the guys and that's just fine. As long as she gets her athletic scholarship to a powerhouse university.But everything sh ONE OF THE BOYSWhat girl doesn't want to be surrounded by gorgeous jocks day in and day out? Jordan Woods isn't just surrounded by hot guys  though-she leads them as the captain and quarterback of her high school football team. They all see her as one of the guys and that's just fine. As long as she gets her athletic scholarship to a powerhouse university.But everything she's ever worked for is threatened when Ty Green moves to her school. Not only is he an amazing QB||Fore More You should read this books. Thanks
Young Adult,Aristotle and Dante Discover the Secrets of the Universe (Aristotle and Dante Discover the Secrets of the Universe #1),58.14,14,4,41164b8ac02a2c42,Books,0,0,This Printz Honor Book is a “tender  honest exploration of identity” (Publishers Weekly) that distills lyrical truths about family and friendship.Aristotle is an angry teen with a brother in prison. Dante is a know-it-all who has an unusual way of looking at the world. When the two meet at the swimming pool  they seem to have nothing in common. But as the loners start spen This Printz Honor Book is a “tender||Fore More You should read this books. Thanks
Young Adult,The Epidemic (The Program 0.6),14.44,12,5,f732d7d18a91d2ba,Books,0,0,Can one girl help others find closure by slipping into the identities of their loved ones? Find out in this riveting sequel to The Remedy and companion to the New York Times bestselling The Treatment and The Program.In a world before The Program…Quinlan McKee has spent her life acting as other people. She was a closer—a person hired to play the role of the recently decease Can one girl help others find closure by slipping into the identities of their loved ones? Find out in this riveting sequel to The Remedy and companion to the New York Times bestselling The Treatment and The Program.In a world before The Program…Quinlan McKee has spent her life acting as other people. She was a closer—a person hired to play the role of the recently deceased in order to give their families closure. Through this process  Quinn learned to read people and situations  even losing a bit of herself to do so. But she couldn’t have guessed how her last case would bring down her entire world.The only person Quinn trusts is Deacon||Fore More You should read this books. Thanks
Young Adult,Stars Above (The Lunar Chronicles #4.5),48.05,12,2,b63ea3f7a57ae099,Books,0,0,The enchantment continues....The universe of the Lunar Chronicles holds stories—and secrets—that are wondrous  vicious  and romantic. How did Cinder first arrive in New Beijing? How did the brooding soldier Wolf transform from young man to killer? When did Princess Winter and the palace guard Jacin realize their destinies?With nine stories—five of which have never before b The enchantment continues....The universe of the Lunar Chronicles holds stories—and secrets—that are wondrous||Fore More You should read this books. Thanks
Young Adult,No Love Allowed (Dodge Cove #1),54.65,12,4,db84624b151cbe06,Books,0,0,It's all fun and parties until someone falls in love in this modern fairy tale from author Kate Evangelista.Caleb desperately needs a fake girlfriend. Either he attends a series of parties for his father’s law firm with a pretty girl on his arm  or he gets shipped off to Yale to start a future he’s not ready for and isn’t sure he wants. And sadly  the last unattached girl It's all fun and parties until someone falls in love in this modern fairy tale from author Kate Evangelista.Caleb desperately needs a fake girlfriend. Either he attends a series of parties for his father’s law firm with a pretty girl on his arm||Fore More You should read this books. Thanks
Young Adult,"Exit, Pursued by a Bear",51.34,11,4,c65c25d990fc7025,Books,0,0,“I love you ” Polly says suddenly when I’m almost to the door.“I know ” I say.Hermione Winters has been a flyer. She’s been captain of her cheerleading team. The envied girlfriend and the undisputed queen of her school. Now it’s her last year and those days and those labels are fading fast. In a few months she’ll be a different person. She thinks she’s ready for whatever c “I love you||Fore More You should read this books. Thanks
Young Adult,The Alien Club,54.4,9,1,e77594ece9b9d1fe,Books,0,0,When everything is your first  you’re an alien.The feelings  sensations||Fore More You should read this books. Thanks
Young Adult,Don't Forget Steven,33.23,9,1,e845d305f64154f1,Books,0,0,By the author of Ruby  Between the Cracks  a winner of the Top Ten Best Books for Teens 2015 award||Fore More You should read this books. Thanks
Young Adult,South of Sunshine,28.93,8,1,331c26103d885cae,Books,0,0,What is Kaycee willing to risk for the sake of love? And what will she risk for acceptance?In Sunshine  Tennessee  the main event in town is Friday night football||Fore More You should read this books. Thanks
Young Adult,My Life Next Door (My Life Next Door ),36.39,8,5,9a7291b89bd5445c,Books,0,0,"""One thing my mother never knew  and would disapprove of most of all  was that I watched the Garretts. All the time.""The Garretts are everything the Reeds are not. Loud||Fore More You should read this books. Thanks"
Young Adult,Future Shock (Future Shock #1),55.65,8,5,df6a7c43faa6732b,Books,0,0,What do you do when the future is too late  and the present is counting down to an inevitable moment?Elena Martinez has street smarts  the ability for perfect recall||Fore More You should read this books. Thanks
Young Adult,Nightstruck: A Novel,50.35,7,4,746029796363aa51,Books,0,0,It starts with a cry in the night.Becket  walking her dog one winter evening  fears it’s an abandoned baby left out in the cold. But it is something else—something evil—and it tricks Becket into opening a doorway to another realm||Fore More You should read this books. Thanks
Young Adult,Tell the Wolves I'm Home,50.96,6,2,2a1b3d967cda1da2,Books,0,0,In this striking literary debut  Carol Rifka Brunt unfolds a moving story of love  grief||Fore More You should read this books. Thanks
Young Adult,"Will Grayson, Will Grayson (Will Grayson, Will Grayson)",47.31,5,4,e75f3ae1da1cc652,Books,0,0,Will Grayson meets Will Grayson. One cold night  in a most unlikely corner of Chicago  two strangers are about to cross paths. From that moment on||Fore More You should read this books. Thanks
Young Adult,Where She Went (If I Stay #2),41.73,5,4,60369d96b7b80869,Books,0,0,It's been three years since the devastating accident . . . three years since Mia walked out of Adam's life forever.Now living on opposite coasts  Mia is Juilliard's rising star and Adam is LA tabloid fodder  thanks to his new rock star status and celebrity girlfriend. When Adam gets stuck in New York by himself||Fore More You should read this books. Thanks
Young Adult,Two Summers,14.64,5,1,3a7d54a264d9f33e,Books,0,0,ONE SUMMER in the French countryside  among sun-kissed fields of lavender . . . ANOTHER SUMMER in upstate New York  along familiar roads that lead to surprises . . . When Summer Everett makes a split-second decision||Fore More You should read this books. Thanks
Young Adult,The Darkest Corners,11.33,5,5,c4182bdb53e2459a,Books,0,0,The Darkest Corners is a psychological thriller about the lies little girls tell  and the deadly truths those lies become.There are ghosts around every corner in Fayette  Pennsylvania. Tessa left when she was nine and has been trying ever since not to think about it after what happened there that last summer. Memories of things so dark will burn themselves into your mind i The Darkest Corners is a psychological thriller about the lies little girls tell||Fore More You should read this books. Thanks
Young Adult,Tell Me Three Things,41.81,5,1,50d5a7b861ed1c54,Books,0,0,Everything about Jessie is wrong. At least  that’s what it feels like during her first weekof junior year at her new ultra-intimidating prep school in Los Angeles. Just when she’s thinking about hightailing it back to Chicago  she gets an email from a person calling themselves Somebody/Nobody (SN for short)||Fore More You should read this books. Thanks
Young Adult,Lola and the Boy Next Door (Anna and the French Kiss #2),23.63,5,4,5e1a88d248599768,Books,0,0,Lola Nolan is a budding costume designer  and for her  the more outrageous||Fore More You should read this books. Thanks
Young Adult,Kill the Boy Band,15.52,5,5,44f545727e704187,Books,0,0,Just know from the start that it wasn’t supposed to go like this. All we wanted was to get near them. That’s why we got a room in the hotel where they were staying.We were not planning to kidnap one of them. Especially not the most useless one. But we had him—his room key  his cell phone  and his secrets.We were not planning on what happened next.We swear.From thrilling ne Just know from the start that it wasn’t supposed to go like this. All we wanted was to get near them. That’s why we got a room in the hotel where they were staying.We were not planning to kidnap one of them. Especially not the most useless one. But we had him—his room key||Fore More You should read this books. Thanks
Young Adult,Isla and the Happily Ever After (Anna and the French Kiss #3),48.13,5,5,45045146dbf7b009,Books,0,0,Love ignites in the City That Never Sleeps  but can it last? Hopeless romantic Isla has had a crush on introspective cartoonist Josh since their first year at the School of America in Paris. And after a chance encounter in Manhattan over the summer  romance might be closer than Isla imagined. But as they begin their senior year back in France||Fore More You should read this books. Thanks
Young Adult,An Abundance of Katherines,10,5,5,f36d24c309e87e5b,Books,0,0,Katherine V thought boys were gross Katherine X just wanted to be friends Katherine XVIII dumped him in an e-mail K-19 broke his heart When it comes to relationships  Colin Singleton's type happens to be girls named Katherine. And when it comes to girls named Katherine  Colin is always getting dumped. Nineteen times||Fore More You should read this books. Thanks
Young Adult,Harry Potter and the Prisoner of Azkaban (Harry Potter #3),24.17,4,4,eff24325e0ede639,Books,0,0,Harry Potter is lucky to reach the age of thirteen  since he has already survived the murderous attacks of the feared Dark Lord on more than one occasion. But his hopes for a quiet term concentrating on Quidditch are dashed when a maniacal mass-murderer escapes from Azkaban  pursued by the soul-sucking Dementors who guard the prison. It's assumed that Hogwarts is the safes Harry Potter is lucky to reach the age of thirteen||Fore More You should read this books. Thanks
Young Adult,Walk the Edge (Thunder Road #2),32.36,3,3,0e4e2d31c2fb3aad,Books,0,0,"One moment of recklessness will change their worlds.Smart. Responsible. That's seventeen-year-old Breanna's role in her large family  and heaven forbid she put a toe out of line. Until one night of shockingly un-Breanna-like behavior puts her into a vicious cyber-bully's line of fire—and brings fellow senior Thomas ""Razor"" Turner into her life. Razor lives for the Reign of One moment of recklessness will change their worlds.Smart. Responsible. That's seventeen-year-old Breanna's role in her large family  and heaven forbid she put a toe out of line. Until one night of shockingly un-Breanna-like behavior puts her into a vicious cyber-bully's line of fire—and brings fellow senior Thomas ""Razor"" Turner into her life. Razor lives for the Reign of Terror motorcycle club||Fore More You should read this books. Thanks"
Young Adult,Two Boys Kissing,32.74,3,2,61bc8167c9680283,Books,0,0,New York Times bestselling author David Levithan tells the based-on-true-events story of Harry and Craig  two 17-year-olds who are about to take part in a 32-hour marathon of kissing to set a new Guinness World Record—all of which is narrated by a Greek Chorus of the generation of gay men lost to AIDS. While the two increasingly dehydrated and sleep-deprived boys are locki New York Times  bestselling author David Levithan tells the based-on-true-events story of Harry and Craig  two 17-year-olds who are about to take part in a 32-hour marathon of kissing to set a new Guinness World Record—all of which is narrated by a Greek Chorus of the generation of gay men lost to AIDS. While the two increasingly dehydrated and sleep-deprived boys are locking lips||Fore More You should read this books. Thanks
Young Adult,The New Guy (and Other Senior Year Distractions),44.92,3,3,3e42ac0f4d43320f,Books,0,0,A ridiculously cute  formerly-famous new guy dropping into your life? It's practically every girl's dream. But not Jules McCallister-Morgan's. I realize that on paper I look like your standard type-A  neurotic||Fore More You should read this books. Thanks
Young Adult,"The Land of 10,000 Madonnas",29.64,3,4,35e69a79d2b1e804,Books,0,0,Five teens backpack through Europe to fulfill the mysterious dying wish of their friend.Jesse lives with his history professor dad in a house covered with postcards of images of the Madonna from all over the world. They’re gotten used to this life: two motherless dudes living among thousands of Madonnas. But Jesse has a heart condition that will ultimately cut his life tra Five teens backpack through Europe to fulfill the mysterious dying wish of their friend.Jesse lives with his history professor dad in a house covered with postcards of images of the Madonna from all over the world. They’re gotten used to this life: two motherless dudes living among thousands of Madonnas. But Jesse has a heart condition that will ultimately cut his life tragically short. Before he dies  he arranges a mysterious trip to Europe for his three cousins  his best friend||Fore More You should read this books. Thanks
Young Adult,Scarlet (The Lunar Chronicles #2),14.57,3,4,510832818edb6fbc,Books,0,0,Cinder  the cyborg mechanic  returns in the second thrilling installment of the bestselling Lunar Chronicles. She’s trying to break out of prison—even though if she succeeds||Fore More You should read this books. Thanks
Young Adult,Legend (Legend #1),43.69,3,4,0ce8075fab4a2b5b,Books,0,0,There is an alternate cover edition for this ISBN13 here.What was once the western United States is now home to the Republic  a nation perpetually at war with its neighbors. Born into an elite family in one of the Republic's wealthiest districts  fifteen-year-old June is a prodigy being groomed for success in the Republic's highest military circles. Born into the slums||Fore More You should read this books. Thanks
Young Adult,Lady Renegades (Rebel Belle #3),53.04,3,5,16e843e6b853cc2f,Books,0,0,Just as Harper Price starts coming to terms with her role as David Stark’s battle-ready Paladin  protector  and girlfriend—her world goes crazy all over again.Overwhelmed by his Oracle powers||Fore More You should read this books. Thanks
Young Adult,Golden (Heart of Dread #3),42.21,3,4,984b3b6e7479b571,Books,0,0,The action-packed finale to the Heart of Dread seriesIn this epic conclusion to the trilogy  Nat and Wes go on a journey to find the Rift  save the source of magic and defeat the Drau||Fore More You should read this books. Thanks
Young Adult,Cinder (The Lunar Chronicles #1),26.09,3,1,7e9579921e5407cb,Books,0,0,Humans and androids crowd the raucous streets of New Beijing. A deadly plague ravages the population. From space  a ruthless lunar people watch  waiting to make their move. No one knows that Earth’s fate hinges on one girl.Cinder||Fore More You should read this books. Thanks
Young Adult,Boy Meets Boy,21.12,3,3,8e0bc2fe4e7d35b5,Books,0,0,This is the story of Paul  a sophomore at a high school like no other: The cheerleaders ride Harleys  the homecoming queen used to be a guy named Daryl (she now prefers Infinite Darlene and is also the star quarterback)||Fore More You should read this books. Thanks
Young Adult,Annie on My Mind,36.83,3,5,7bf87402413c27ff,Books,0,0,This groundbreaking book is the story of two teenage girls whose friendship blossoms into love and who  despite pressures from family and school that threaten their relationship  promise to be true to each other and their feelings. This book is so truthful and honest||Fore More You should read this books. Thanks
Young Adult,New Moon (Twilight #2),12.86,2,4,6fa3ea52c8e31e06,Books,0,0,Also see: Alternate Cover Editions for this ISBN [ACE] ACE #1 I knew we were both in mortal danger. Still  in that instant  I felt well. Whole. I could feel my heart racing in my chest||Fore More You should read this books. Thanks
Young Adult,Girl Online On Tour (Girl Online #2),53.47,2,1,97b8f130d32e9f4e,Books,0,0,The sequel to the number-one bestseller Girl Online. Penny joins her rock-star boyfriend  Noah  on his European music tour.Penny's bags are packed.When Noah invites Penny on his European music tour||Fore More You should read this books. Thanks
Young Adult,The Haters,27.89,1,5,fff8a057a40c4a60,Books,0,0,From Jesse Andrews  author of the New York Times bestselling Me and Earl and the Dying Girl and screenwriter of the Sundance award–winning motion picture of the same name  comes a groundbreaking young adult novel about music||Fore More You should read this books. Thanks
Young Adult,The Art of Not Breathing,40.83,1,4,5bc1fbccfbf2355c,Books,0,0,Since her twin brother  Eddie  drowned five years ago||Fore More You should read this books. Thanks
Science,The Most Perfect Thing: Inside (and Outside) a Bird's Egg,42.96,16,4,aadee1c326d286e3,Books,0,0,Renowned ornithologist Tim Birkhead opens this gripping story as a female guillemot chick hatches  already carrying her full quota of tiny eggs within her undeveloped ovary. As she grows into adulthood  only a few of her eggs mature||Fore More You should read this books. Thanks
Science,Immunity: How Elie Metchnikoff Changed the Course of Modern Medicine,57.36,16,5,e4f74c16de34d440,Books,0,0,Around Christmas of 1882  while peering through a microscope at starfish larvae in which he had inserted tiny thorns  Russian zoologist Elie Metchnikoff had a brilliant insight: what if the mobile cells he saw gathering around the thorns were nothing but a healing force in action? Metchnikoff’s daring theory of immunity—that voracious cells he called phagocytes formed the Around Christmas of 1882||Fore More You should read this books. Thanks
Science,Sorting the Beef from the Bull: The Science of Food Fraud Forensics,44.74,14,4,3edcccc4f341fb1a,Books,0,0,Horse meat in our burgers  melamine in our infant formula  artificial colors in our fish and fruit--as our urban lifestyle takes us farther away from our food sources||Fore More You should read this books. Thanks
Science,Tipping Point for Planet Earth: How Close Are We to the Edge?,37.55,12,1,148715df5a02ea5e,Books,0,0,Tipping Point for Planet Earth explains why Earth is headed for a tipping point  a change so fast  dramatic||Fore More You should read this books. Thanks
Science,"The Fabric of the Cosmos: Space, Time, and the Texture of Reality",55.91,9,1,ca74f2e3c35a3e77,Books,0,0,From Brian Greene  one of the world’s leading physicists and author the Pulitzer Prize finalist The Elegant Universe  comes a grand tour of the universe that makes us look at reality in a completely different way.Space and time form the very fabric of the cosmos. Yet they remain among the most mysterious of concepts. Is space an entity? Why does time have a direction? Coul From Brian Greene||Fore More You should read this books. Thanks
Science,Diary of a Citizen Scientist: Chasing Tiger Beetles and Other New Ways of Engaging the World,28.41,8,1,0c11e2d068768dbb,Books,0,0,In the exploding world of citizen science  hundreds of thousands of volunteers are monitoring climate change  tracking bird migration||Fore More You should read this books. Thanks
Science,The Origin of Species,10.01,7,4,0345872b14f9e774,Books,0,0,The publication of Darwin’s The Origin of Species in 1859 marked a dramatic turning point in scientific thought. The volume had taken Darwin more than twenty years to publish  in part because he envisioned the storm of controversy it was certain to unleash. Indeed  selling out its first edition on its first day||Fore More You should read this books. Thanks
Science,The Grand Design,13.76,5,3,3213b1f13f5f0f7c,Books,0,0,THE FIRST MAJOR WORK IN NEARLY A DECADE BY ONE OF THE WORLD’S GREAT THINKERS—A MARVELOUSLY CONCISE BOOK WITH NEW ANSWERS TO THE ULTIMATE QUESTIONS OF LIFEWhen and how did the universe begin? Why are we here? Why is there something rather than nothing? What is the nature of reality? Why are the laws of nature so finely tuned as to allow for the existence of beings like ours THE FIRST MAJOR WORK IN NEARLY A DECADE BY ONE OF THE WORLD’S GREAT THINKERS—A MARVELOUSLY CONCISE BOOK WITH NEW ANSWERS TO THE ULTIMATE QUESTIONS OF LIFE When and how did the universe begin? Why are we here? Why is there something rather than nothing? What is the nature of reality? Why are the laws of nature so finely tuned as to allow for the existence of beings like ourselves? And  finally  is the apparent “grand design” of our universe evidence of a benevolent creator who set things in motion—or does science offer another explanation? The most fundamental questions about the origins of the universe and of life itself||Fore More You should read this books. Thanks
Science,Peak: Secrets from the New Science of Expertise,16.28,5,2,6036239d2ab349b7,Books,0,0,A survey of the psychology of expertise  providing techniques for developing mastery of any skill  drawn from the authors' extensive||Fore More You should read this books. Thanks
Science,"The Elegant Universe: Superstrings, Hidden Dimensions, and the Quest for the Ultimate Theory",13.03,3,4,c6bf14cb901c63ac,Books,0,0,The international bestseller that inspired a major Nova special and sparked a new understanding of the universe  now with a new preface and epilogue.Brian Greene  one of the world's leading string theorists||Fore More You should read this books. Thanks
Science,"The Disappearing Spoon: And Other True Tales of Madness, Love, and the History of the World from the Periodic Table of the Elements",57.35,3,5,63c0826ef59eae66,Books,0,0,From New York Times bestselling author Sam Kean comes incredible stories of science  history  finance||Fore More You should read this books. Thanks
