Genre,Title,price,Stock,Star,UPC,Type,Tax,Number of reviews,desc
Fiction,The Regional Office Is Under Attack!,51.36,15,5,0651062381f0636a,Books,0,0,In a world beset by amassing forces of darkness  one organization—the Regional Office—and its coterie of super-powered female assassins protects the globe from annihilation. At its helm  the mysterious Oyemi and her oracles seek out new recruits and root out evil plots. Then a prophecy suggests that someone from inside might bring about its downfall. And now||Fore More You should read this books. Thanks
Fiction,Finders Keepers (Bill Hodges Trilogy #2),53.53,15,5,edb3097e71330040,Books,0,0,A masterful  intensely suspenseful novel about a reader whose obsession with a reclusive writer goes far too far—a book about the power of storytelling  starring the same trio of unlikely and winning heroes King introduced in Mr. Mercedes“Wake up||Fore More You should read this books. Thanks
Fiction,The Time Keeper,27.88,14,5,e9906e2f0d189745,Books,0,0,In this fable  the first man on earth to count the hours becomes Father Time. The inventor of the world's first clock is punished for trying to measure God's greatest gift. He is banished to a cave for centuries and forced to listen to the voices of all who come after him seeking more days  more years. Eventually||Fore More You should read this books. Thanks
Fiction,The Testament of Mary,52.67,14,4,081305e6df719dff,Books,0,0,Provocative  haunting  and indelible||Fore More You should read this books. Thanks
Fiction,The First Hostage (J.B. Collins #2),25.85,14,3,a86972014275e072,Books,0,0,“The president of the United States . . . is missing.”With these words  New York Times journalist J. B. Collins  reporting from the scene of a devastating attack by ISIS terrorists in Amman||Fore More You should read this books. Thanks
Fiction,Take Me with You,45.21,14,3,2c04320e110a14a3,Books,0,0,August Shroeder  a burned-out teacher  has been sober since his 19-year-old son died. Every year he's spent the summer on the road||Fore More You should read this books. Thanks
Fiction,Still Life with Bread Crumbs,26.41,14,3,fe44cc816576c652,Books,0,0,A superb love story from Anna Quindlen  the #1 New York Times bestselling author of Rise and Shine  Blessings||Fore More You should read this books. Thanks
Fiction,Shtum,55.84,14,4,830fb3967c74866d,Books,0,0,Powerful  darkly funny and heart-breaking  Shtum is a story about fathers and sons||Fore More You should read this books. Thanks
Fiction,My Name Is Lucy Barton,41.56,14,1,727bf2b86b19ad88,Books,0,0,A new book by Pulitzer Prize winner Elizabeth Strout is cause for celebration. Her bestselling novels  including Olive Kitteridge and The Burgess Boys have illuminated our most tender relationships. Now||Fore More You should read this books. Thanks
Fiction,My Mrs. Brown,24.48,14,3,cc82685d9f49bc2c,Books,0,0,From William Norwich  the well-known fashion writer and editor  an unforgettable novel about a woman with a secret who travels to New York City on a determined quest to buy a special dress that represents everything she wants to say about that secret…and herself.Sometimes a dress isn’t just a dress.Emilia Brown is a woman of a certain age. She has spent a frugal||Fore More You should read this books. Thanks
Fiction,Mr. Mercedes (Bill Hodges Trilogy #1),28.9,14,1,caa2e5b3fb1b2d4c,Books,0,0,In the frigid pre-dawn hours  in a distressed Midwestern city  hundreds of desperate unemployed folks are lined up for a spot at a job fair. Without warning||Fore More You should read this books. Thanks
Fiction,I Am Pilgrim (Pilgrim #1),10.6,14,4,aeff7b87a8e83ebb,Books,0,0,A breakneck race against time...and an implacable enemy.An anonymous young woman murdered in a run-down hotel  all identifying characteristics dissolved by acid. A father publicly beheaded in the blistering heat of a Saudi Arabian public square. A notorious Syrian biotech expert found eyeless in a Damascus junkyard. Smoldering human remains on a remote mountainside in Afgh A breakneck race against time...and an implacable enemy.An anonymous young woman murdered in a run-down hotel  all identifying characteristics dissolved by acid. A father publicly beheaded in the blistering heat of a Saudi Arabian public square. A notorious Syrian biotech expert found eyeless in a Damascus junkyard. Smoldering human remains on a remote mountainside in Afghanistan. A flawless plot to commit an appalling crime against humanity. One path links them all||Fore More You should read this books. Thanks
Fiction,Eligible (The Austen Project #4),27.09,14,3,9eaf58b03a2779cc,Books,0,0,A Modern Retelling of Pride and PrejudiceThis version of the Bennet family—and Mr. Darcy—is one that you have and haven’t met before: Liz is a magazine writer in her late thirties who  like her yoga instructor older sister  Jane||Fore More You should read this books. Thanks
Fiction,Eight Hundred Grapes,14.39,14,4,1d6dd0c87d90fe92,Books,0,0,There are secrets you share  and secrets you hide…Growing up on her family’s Sonoma vineyard  Georgia Ford learned some important secrets. The secret number of grapes it takes to make a bottle of wine: eight hundred. The secret ingredient in her mother’s lasagna: chocolate. The secret behind ending a fight: hold hands.But just a week before her wedding||Fore More You should read this books. Thanks
Fiction,Dear Mr. Knightley,11.21,14,5,94a958ea126cdcd5,Books,0,0,Dear Mr. Knightley is a contemporary epistolary novel with a delightful dash of Jane Austen.Samantha Moore survived years of darkness in the foster care system by hiding behind her favorite characters in literature  even adopting their very words. Her fictional friends give her an identity  albeit a borrowed one. But most importantly||Fore More You should read this books. Thanks
Fiction,Cometh the Hour (The Clifton Chronicles #6),25.01,14,3,28cf0d1c51b491e5,Books,0,0,Cometh the Hour opens with the reading of a suicide note  which has devastating consequences for Harry and Emma Clifton  Giles Barrington and Lady Virginia.Giles must decide if he should withdraw from politics and try to rescue Karin||Fore More You should read this books. Thanks
Fiction,Balloon Animals,17.03,14,3,9b65f676984c9f0c,Books,0,0,BALLOON ANIMALS is a pilgrimage and road-trip of unusual dimensions.Follow me  Jonny Rowe  on a wild goose-chase from Ireland to the USA with my American grandfather's remains in my red birthday balloon. I use 'remains' in the loosest sense of the word: my grandfather||Fore More You should read this books. Thanks
Fiction,A Man Called Ove,39.72,14,1,8682c03de6a844ff,Books,0,0,A grumpy yet loveable man finds his solitary world turned on its head when a boisterous young family moves in next door.Meet Ove. He's a curmudgeon  the kind of man who points at people he dislikes as if they were burglars caught outside his bedroom window. He has staunch principles  strict routines||Fore More You should read this books. Thanks
Fiction,The Silent Sister (Riley MacPherson #1),46.29,12,5,ce1ae197ada2aec4,Books,0,0,In The Silent Sister  Riley MacPherson has spent her entire life believing that her older sister Lisa committed suicide as a teenager. Now  over twenty years later||Fore More You should read this books. Thanks
Fiction,The Dinner Party,56.54,12,2,c6ca293d4810e0d5,Books,0,0,This Passover Seder is not just any Passover Seder. Yes  there will be a quick service and then a festive meal afterwards  but this night is different from all other nights. This will be the night the Golds of Greenwich meet the Rothschilds of New York City.The Rothschilds are the stuff of legends. They control banks||Fore More You should read this books. Thanks
Fiction,The Improbability of Love,59.45,11,1,437d8dea9272d0a9,Books,0,0,A dazzling  witty and tenderly savage satire of London life and the art world that is also a surprising and wonderful love story.When lovelorn Annie McDee stumbles across a dirty painting in a junk shop while looking for a present for an unsuitable man  she has no idea what she has discovered. Soon she finds herself drawn unwillingly into the tumultuous London art world||Fore More You should read this books. Thanks
Fiction,Mothering Sunday,13.34,11,2,47e1b2d43f709995,Books,0,0,From the Booker Award winner: a luminous  profoundly moving work of fiction that begins with an afternoon tryst in 1924 between a servant girl and the young man of the neighboring house  but then opens to reveal the whole life of a remarkable woman.Twenty-two year old Jane Fairchild||Fore More You should read this books. Thanks
Fiction,Lies and Other Acts of Love,45.14,11,1,469508882dfc1991,Books,0,0,Dear Carolina was praised as “Southern fiction at its best.”* Now author Kristy Woodson Harvey presents a new novel about what it really means to tell the truth . . . After sixty years of marriage and five daughters  Lynn “Lovey” White knows that all of us  from time to time||Fore More You should read this books. Thanks
Fiction,Daredevils,16.34,11,3,f608c903c451f387,Books,0,0,From the winner of 2014’s PEN Robert W. Bingham Prize  an unforgettable debut novel about Loretta  a teenager married off as a “sister wife||Fore More You should read this books. Thanks
Fiction,11/22/63,48.48,11,3,a9d7b75461084a26,Books,0,0,Life can turn on a dime—or stumble into the extraordinary  as it does for Jake Epping  a high school English teacher in Lisbon Falls||Fore More You should read this books. Thanks
Fiction,The Shack,28.03,9,1,903a9f8090104c2c,Books,0,0,Mackenzie Allen Philips' youngest daughter  Missy  has been abducted during a family vacation||Fore More You should read this books. Thanks
Fiction,The High Mountains of Portugal,51.15,8,1,4f283dfcbeccc0d4,Books,0,0,In Lisbon in 1904  a young man named Tomás discovers an old journal. It hints at the existence of an extraordinary artifact that—if he can find it—would redefine history. Traveling in one of Europe’s earliest automobiles  he sets out in search of this strange treasure.Thirty-five years later||Fore More You should read this books. Thanks
Fiction,Miller's Valley,58.54,8,2,bff270fe9c86a5a9,Books,0,0,Filled with insights that are hallmarks of Anna Quindlen’s bestsellers  this extraordinary novel is about a woman coming of age  as she unearths secrets about her family and her town||Fore More You should read this books. Thanks
Fiction,Hystopia: A Novel,21.96,8,4,0bfdef63285d3019,Books,0,0,"By the early 1970s  President John F. Kennedy has survived several assassination attempts and--martyred  heroic--is now in his third term. Twenty-two-year-old Eugene Allen returns home from his tour of duty in Vietnam and begins to write a war novel--a book echoing Catch-22 and Slaughterhouse-Five--about veterans who have their battlefield experiences ""enfolded||Fore More You should read this books. Thanks"
Fiction,The Bourne Identity (Jason Bourne #1),42.78,7,4,d250657f0ebc5d73,Books,0,0,Who is Jason Bourne? Is he an assassin  a terrorist  a thief? Why has he got four million dollars in a Swiss bank account? Why has someone tried to murder him?...Jason Bourne does not know the answer to any of these questions. Suffering from amnesia||Fore More You should read this books. Thanks
Fiction,Sister Dear,40.2,7,4,7ffebdd1d5148aef,Books,0,0,All Allie Marshall wants is a fresh start. But when dark secrets refuse to stay buried  will her chance at a new life be shattered forever?Convicted of a crime she didn’t commit  Allie watched a decade of her life vanish – time that can never be recovered. Now||Fore More You should read this books. Thanks
Fiction,Memoirs of a Geisha,49.67,7,3,dac4b5847454fd9b,Books,0,0,A literary sensation and runaway bestseller  this brilliant debut novel presents with seamless authenticity and exquisite lyricism the true confessions of one of Japan's most celebrated geisha.In Memoirs of a Geisha  we enter a world where appearances are paramount; where a girl's virginity is auctioned to the highest bidder; where women are trained to beguile the most pow A literary sensation and runaway bestseller||Fore More You should read this books. Thanks
Fiction,Me Before You (Me Before You #1),19.02,6,1,7a2b51f69e81c722,Books,0,0,Lou Clark knows lots of things. She knows how many footsteps there are between the bus stop and home. She knows she likes working in The Buttered Bun tea shop and she knows she might not love her boyfriend Patrick.What Lou doesn't know is she's about to lose her job or that knowing what's coming is what keeps her sane.Will Traynor knows his motorcycle accident took away hi Lou Clark knows lots of things. She knows how many footsteps there are between the bus stop and home. She knows she likes working in The Buttered Bun tea shop and she knows she might not love her boyfriend Patrick.What Lou doesn't know is she's about to lose her job or that knowing what's coming is what keeps her sane.Will Traynor knows his motorcycle accident took away his desire to live. He knows everything feels very small and rather joyless now and he knows exactly how he's going to put a stop to that.What Will doesn't know is that Lou is about to burst into his world in a riot of colour. And neither of them knows they're going to change the other for all time. ...more||Fore More You should read this books. Thanks
Fiction,Deception Point,40.32,6,4,4e3b183180e2a992,Books,0,0,When a new NASA satellite spots evidence of an astonishingly rare object buried deep in the Arctic ice  the floundering space agency proclaims a much-needed victory...a victory that has profound implications for U.S. space policy and the impending presidential election. With the Oval Office in the balance  the President dispatches White House Intelligence analyst Rachel Se When a new NASA satellite spots evidence of an astonishingly rare object buried deep in the Arctic ice||Fore More You should read this books. Thanks
Fiction,The Little Paris Bookshop,24.73,5,3,dfd9ff1f343cdaff,Books,0,0,“There are books that are suitable for a million people  others for only a hundred. There are even remedies—I mean books—that were written for one person only…A book is both medic and medicine at once. It makes a diagnosis as well as offering therapy. Putting the right novels to the appropriate ailments: that’s how I sell books.”Monsieur Perdu calls himself a literary apot “There are books that are suitable for a million people  others for only a hundred. There are even remedies—I mean books—that were written for one person only…A book is both medic and medicine at once. It makes a diagnosis as well as offering therapy. Putting the right novels to the appropriate ailments: that’s how I sell books.”Monsieur Perdu calls himself a literary apothecary. From his floating bookstore in a barge on the Seine||Fore More You should read this books. Thanks
Fiction,The Firm,45.56,5,3,ad84f18659e6bfe2,Books,0,0,When Mitch McDeere signed on with Bendini  Lambert & Locke of Memphis  he thought that he and his beautiful wife||Fore More You should read this books. Thanks
Fiction,The Expatriates,44.58,5,2,fe7210553d56c097,Books,0,0,“A female  funny Henry James in Asia  Janice Y. K. Lee is vividly good on the subject of Americans abroad.” —The New York Times Book Review“Sex and the City meets Lost in Translation.” —The SkimmJanice Y. K. Lee’s New York Times bestselling debut||Fore More You should read this books. Thanks
Fiction,Siddhartha,34.22,5,5,84bb29c53592ac40,Books,0,0,In the novel  Siddhartha  a young man||Fore More You should read this books. Thanks
Fiction,Last One Home (New Beginnings #1),59.98,5,3,07e6810fd3236bda,Books,0,0,Growing up  Cassie Carter and her sisters  Karen and Nichole||Fore More You should read this books. Thanks
Fiction,Digital Fortress,58,5,5,94bb629a3f6dd00b,Books,0,0,Before the multi-million  runaway bestseller The Da Vinci Code  Dan Brown set his razor-sharp research and storytelling skills on the most powerful intelligence organization on earth--the National Security Agency (NSA)||Fore More You should read this books. Thanks
Fiction,Atlas Shrugged,26.58,4,5,78a4ac98191ac675,Books,0,0,This is the story of a man who said that he would stop the motor of the world and did. Was he a destroyer or the greatest of liberators?Why did he have to fight his battle  not against his enemies  but against those who needed him most||Fore More You should read this books. Thanks
Fiction,Three-Martini Lunch,23.21,3,3,57f755143ee96fd4,Books,0,0,From the author of the “thrilling” (The Christian Science Monitor) novel The Other Typist comes an evocative  multilayered story of ambition  success||Fore More You should read this books. Thanks
Fiction,The Nightingale,26.26,3,4,29d6d87f3418638b,Books,0,0,In love we find out who we want to be.In war we find out who we are.FRANCE  1939In the quiet village of Carriveau  Vianne Mauriac says goodbye to her husband||Fore More You should read this books. Thanks
Fiction,The Infinities,27.41,3,1,554e9e2d532b3a87,Books,0,0,On a languid midsummer’s day in the countryside  old Adam Godley  a renowned theoretical mathematician||Fore More You should read this books. Thanks
Fiction,The Husband's Secret,52.51,3,5,ff6bb30dd0c482a6,Books,0,0,At the heart of The Husband’s Secret is a letter that’s not meant to be readMy darling Cecilia  if you’re reading this  then I’ve died...Imagine that your husband wrote you a letter||Fore More You should read this books. Thanks
Fiction,The Da Vinci Code (Robert Langdon #2),22.96,3,2,dabf11918b48b40c,Books,0,0,An ingenious code hidden in the works of Leonardo da Vinci. A desperate race through the cathedrals and castles of Europe. An astonishing truth concealed for centuries . . . unveiled at last.While in Paris  Harvard symbologist Robert Langdon is awakened by a phone call in the dead of the night. The elderly curator of the Louvre has been murdered inside the museum  his body An ingenious code hidden in the works of Leonardo da Vinci. A desperate race through the cathedrals and castles of Europe. An astonishing truth concealed for centuries . . . unveiled at last.While in Paris||Fore More You should read this books. Thanks
Fiction,The Art of Fielding,22.1,3,1,2858ac90c4758e1f,Books,0,0,At Westish College  a small school on the shore of Lake Michigan  baseball star Henry Skrimshander seems destined for big league stardom. But when a routine throw goes disastrously off course||Fore More You should read this books. Thanks
Fiction,Lila (Gilead #3),12.47,3,3,4ef75307fb64e2ad,Books,0,0,Marilynne Robinson  one of the greatest novelists of our time  returns to the town of Gilead in an unforgettable story of a girlhood lived on the fringes of society in fear||Fore More You should read this books. Thanks
Fiction,Jurassic Park (Jurassic Park #1),44.97,3,1,a0dd11f6abc421ec,Books,0,0,A billionaire has created a technique to clone dinosaurs. From the DNA that his crack team of scientists extract  he is able to grow the dinosaurs in his laboratories and lock them away on an island behind electric fences  creating a sort of theme park. He asks a group of scientists from several different fields to come and view the park||Fore More You should read this books. Thanks
Fiction,Inferno (Robert Langdon #4),41,3,5,6c4646d90b60a56c,Books,0,0,In his international blockbusters The Da Vinci Code  Angels & Demons  and The Lost Symbol||Fore More You should read this books. Thanks
Fiction,Crazy Rich Asians (Crazy Rich Asians #1),49.13,3,5,c9782ad2a0ed9331,Books,0,0,Crazy Rich Asians is the outrageously funny debut novel about three super-rich  pedigreed Chinese families and the gossip  backbiting||Fore More You should read this books. Thanks
Fiction,Big Little Lies,22.11,3,1,d3f9c4539c0caa64,Books,0,0,Big Little Lies follows three women  each at a crossroads:Madeline is a force to be reckoned with. She’s funny and biting  passionate||Fore More You should read this books. Thanks
Fiction,The Course of Love,16.78,2,3,f3c76b53b239f511,Books,0,0,The long-awaited and beguiling second novel from Alain de Botton that tracks the beautifully complicated arc of a romantic partnership  from the internationally bestselling author of On Love and How Proust Can Change Your Life.We all know the headiness and excitement of the early days of love. But what comes after? In Edinburgh  a couple||Fore More You should read this books. Thanks
Fiction,When I'm Gone,51.96,1,3,c5f91eb481427dc5,Books,0,0,Dear Luke First let me say—I love you…I didn’t want to leave you… Luke Richardson has returned home after burying Natalie  his beloved wife of sixteen years||Fore More You should read this books. Thanks
Fiction,The Silent Wife,12.34,1,5,b78deb463531d078,Books,0,0,A chilling psychological thriller about a marriage  a way of life  and how far one woman will go to keep what is rightfully hersJodi and Todd are at a bad place in their marriage. Much is at stake||Fore More You should read this books. Thanks
Fiction,The Bette Davis Club,30.66,1,3,dfb0849016bc122c,Books,0,0,The morning of her niece’s wedding  Margo Just drinks a double martini and contemplates the many mistakes she’s made in her fifty-odd years of life. Spending three decades in love with a wonderful but unattainable man is pretty high up on her list of missteps  as is a long line of unsuccessful love affairs accompanied by a seemingly endless supply of delicious cocktails.Wh The morning of her niece’s wedding||Fore More You should read this books. Thanks
Fiction,Kitchens of the Great Midwest,57.2,1,5,06f6a57a6d532844,Books,0,0,“A sweet and savory treat.” —People“An impressive feat of narrative jujitsu . . . that keeps readers turning the pages too fast to realize just how ingenious they are.”—The New York Times Book Review  Editor’s Pick“Kitchens of the Great Midwest is a terrific reminder of what can be wrested from suffering and struggle—not only success  but also considerable irony||Fore More You should read this books. Thanks
Fiction,Bright Lines,39.07,1,5,230ac636ea0ea415,Books,0,0,A vibrant debut novel  set in Brooklyn and Bangladesh  Bright Lines follows three young women and one family struggling to make peace with secrets and their past. For as long as she can remember||Fore More You should read this books. Thanks
Childrens,Birdsong: A Story in Pictures,54.64,19,3,9528d0948525bf5f,Books,0,0,Bring the thrilling story of one red bird to life. When an innocent bird meets two cruel kids  their world is forever changed. But exactly how that change unfolds is up to you  in the tradition of Kamishibai—Japanese paper theater. The wordless story by master cartoonist James Sturm is like a haiku—the elegant images leave space for children to inhabit this timeless tale—a Bring the thrilling story of one red bird to life. When an innocent bird meets two cruel kids||Fore More You should read this books. Thanks
Childrens,The Bear and the Piano,36.89,18,1,9f6568e9c95f60b0,Books,0,0,One day  a young bear stumbles upon something he has never seen before in the forest. As time passes  he teaches himself how to play the strange instrument||Fore More You should read this books. Thanks
Childrens,The Secret of Dreadwillow Carse,56.13,16,1,b5ea0b5dabed25a8,Books,0,0,A princess and a peasant girl must embark on a dangerous quest to outwit a centuries-old warning foretelling the fall of the Monarchy in this modern fairytale. In the center of the verdant Monarchy lies Dreadwillow Carse  a black and desolate bog that the happy people of the land do their best to ignore. Little is known about it  except for one dire warning: If any monarc A princess and a peasant girl must embark on a dangerous quest to outwit a centuries-old warning foretelling the fall of the Monarchy in this modern fairytale.   In the center of the verdant Monarchy lies Dreadwillow Carse||Fore More You should read this books. Thanks
Childrens,The White Cat and the Monk: A Retelling of the Poem “Pangur Bán”,58.08,15,4,37c0cb19713d8dda,Books,0,0,A monk leads a simple life. He studies his books late into the evening and searches for truth in their pages. His cat  Pangur  leads a simple life||Fore More You should read this books. Thanks
Childrens,Little Red,13.47,15,3,4aa03792b50f0b22,Books,0,0,On her way to Grandmas house  Little Red Riding Hood meets a wolf. Now  that might scare some little girlsbut not this little girl! She knows just what the wolf is up to||Fore More You should read this books. Thanks
Childrens,Walt Disney's Alice in Wonderland,12.96,14,5,6a31307a81e8f3a8,Books,0,0,The fantastical tale of a young girl chasing her White Rabbit has delighted children since Lewis Carroll wrote it generations ago. Here his Wonderland shines anew  viewed through the looking glasses of two incomparable artists.Mary Blair's vibrant art helped shape the look of Walt Disney's classic animated film. Collected in a picture book for the first time  her illustrat The fantastical tale of a young girl chasing her White Rabbit has delighted children since Lewis Carroll wrote it generations ago. Here his Wonderland shines anew||Fore More You should read this books. Thanks
Childrens,Twenty Yawns,22.08,14,2,1d6443ffba9dfd80,Books,0,0,Featuring lyrical text and beautiful illustrations  this bedtime tale from Pulitzer Prize winner Jane Smiley and Caldecott Honor recipient Lauren Castillo evokes the splashy fun of the beach and the quietude of a moonlit night  with twenty yawns sprinkled in for children to discover and count.As her mom reads a bedtime story||Fore More You should read this books. Thanks
